[
  {
    "pattern_id": "PAT-0001",
    "pattern_key": "cockpit_ergonomics_steering_visibility",
    "title": "椭圆方向盘的人机视野与购买阻断",
    "category": "cockpit_ergonomics",
    "series": ["LS6", "LS8"],
    "hypothesis": "椭圆方向盘的造型取向导致前方/电子后视镜视野遮挡，在部分用户中直接转化为拒购意愿。",
    "issue_ids": ["ISS-0001"],
    "competitive_refs": [],
    "confidence": "medium",
    "status": "confirmed",
    "boundary": "仅 1 家门店、1 个记录时点、2 条证据；严重度按用户原话保留为 blocker，但普遍性未验证。",
    "created_at": "2026-09-11"
  },
  {
    "pattern_id": "PAT-0002",
    "pattern_key": "storage_front_trunk_capacity",
    "title": "前部与车内储物空间不足",
    "category": "storage",
    "series": ["L6", "LS6"],
    "hypothesis": "前备箱/前舱储物箱的容量、开启方式与门板储物深度不足，影响特定使用场景（如钓鱼干湿分离、日常随手收纳）。",
    "issue_ids": ["ISS-0002", "ISS-0003"],
    "competitive_refs": [],
    "confidence": "medium",
    "status": "confirmed",
    "boundary": "容量诉求带有场景特异性（钓鱼用户），不代表普遍需求强度。",
    "created_at": "2026-09-11"
  },
  {
    "pattern_id": "PAT-0003",
    "pattern_key": "interior_luxury_material_perception",
    "title": "内饰豪华感与质感不足（跨车型）",
    "category": "interior",
    "series": ["L6", "LS8", "LS9", "OTHER"],
    "hypothesis": "LS8/LS9 及部分 L6 用户认为内饰用料、配色与配件质感低于豪华品牌预期，并被竞品对比进一步放大。",
    "issue_ids": ["ISS-0005", "ISS-0006", "ISS-0017", "ISS-0019"],
    "competitive_refs": ["极氪7X", "小鹏GX"],
    "confidence": "high",
    "status": "confirmed",
    "boundary": "豪华感属主观感知，缺少量化基准；不等同于材料成本判断。",
    "created_at": "2026-09-11"
  },
  {
    "pattern_id": "PAT-0004",
    "pattern_key": "interior_sharp_edge_injury_risk",
    "title": "内饰锐角造成磕碰与划伤风险",
    "category": "quality_reliability",
    "series": ["L6", "LS6"],
    "hypothesis": "主驾门内侧下沿尖角与冰箱口内沿直角存在磕碰/划伤风险，友商已采用圆角加密封条的成熟方案。",
    "issue_ids": ["ISS-0007"],
    "competitive_refs": ["小鹏", "极氪"],
    "confidence": "medium",
    "status": "confirmed",
    "boundary": "证据集中 1 店，但涉及人身安全，建议按安全项单独评估。",
    "created_at": "2026-09-11"
  },
  {
    "pattern_id": "PAT-0005",
    "pattern_key": "smart_cockpit_voice_assistant",
    "title": "智能座舱语音体验不稳定",
    "category": "smart_cockpit",
    "series": ["LS6"],
    "hypothesis": "IMClaw 在多音字识别、场景推荐与指令程度区分上表现不稳定，削弱智能座舱体验。",
    "issue_ids": ["ISS-0004"],
    "competitive_refs": [],
    "confidence": "medium",
    "status": "confirmed",
    "boundary": "仅 1 店 3 条，需在更多地域（方言区）验证。",
    "created_at": "2026-09-11"
  },
  {
    "pattern_id": "PAT-0006",
    "pattern_key": "nvh_audio_tire_noise",
    "title": "NVH：音响调校与胎噪",
    "category": "nvh",
    "series": ["L6"],
    "hypothesis": "L6 在 BO 音响调校与 19 寸佳通 P10 轮胎胎噪上的 NVH 表现未达部分用户预期。",
    "issue_ids": ["ISS-0008", "ISS-0009"],
    "competitive_refs": [],
    "confidence": "low",
    "status": "confirmed",
    "boundary": "单店、单条且音响为主观听感；胎噪与路面/车速相关，未控制条件。",
    "created_at": "2026-09-11"
  },
  {
    "pattern_id": "PAT-0007",
    "pattern_key": "seating_rear_space_ergonomics",
    "title": "后排空间与人体工程设定",
    "category": "seating_space",
    "series": ["L6", "LS8"],
    "hypothesis": "后排乘坐/头部空间与二排大屏观看距离等人体工程设定存在不适，影响家庭出行体验。",
    "issue_ids": ["ISS-0010", "ISS-0018"],
    "competitive_refs": [],
    "confidence": "low",
    "status": "confirmed",
    "boundary": "跨车型的同一现象，机制不同（L6 空间 vs LS8 大屏距离），合并仅为空间体验主题。",
    "created_at": "2026-09-11"
  },
  {
    "pattern_id": "PAT-0008",
    "pattern_key": "configuration_decontent_perception",
    "title": "配置减配感知削弱价值感",
    "category": "configuration",
    "series": ["L6", "LS6"],
    "hypothesis": "慢充口盖、电吸门、天窗开启、后排电动放倒等配置的缺失或简化被用户读作减配，削弱价值感。",
    "issue_ids": ["ISS-0011"],
    "competitive_refs": [],
    "confidence": "medium",
    "status": "confirmed",
    "boundary": "是否真为减配需与配置表核对；当前只反映用户感知。",
    "created_at": "2026-09-11"
  },
  {
    "pattern_id": "PAT-0009",
    "pattern_key": "sales_service_after_sales_support",
    "title": "售后服务与保障担忧",
    "category": "sales_service",
    "series": ["L6", "LS7"],
    "hypothesis": "智己售后服务体系（如缺少取送车）与既有用户负面口碑引发购前犹豫。",
    "issue_ids": ["ISS-0012"],
    "competitive_refs": ["小米", "极氪"],
    "confidence": "medium",
    "status": "confirmed",
    "boundary": "含门店侧二手口碑，非直接用户样本；stated intent 未等同实际流失。",
    "created_at": "2026-09-11"
  },
  {
    "pattern_id": "PAT-0010",
    "pattern_key": "adas_capability_brand_trust",
    "title": "智驾能力与品牌认知担忧",
    "category": "adas",
    "series": ["L6", "OTHER"],
    "hypothesis": "用户对 L6 智驾硬件规格存疑，且普遍不了解供应商 momenta，智驾卖点难以建立可信度。",
    "issue_ids": ["ISS-0013"],
    "competitive_refs": [],
    "confidence": "medium",
    "status": "confirmed",
    "boundary": "硬件线与实际智驾体验的关系未在本数据中验证；认知缺失不等于能力不足。",
    "created_at": "2026-09-11"
  },
  {
    "pattern_id": "PAT-0011",
    "pattern_key": "configuration_benchmark_convenience_gap",
    "title": "竞品对标暴露的便利配置差距与设计偏好",
    "category": "configuration",
    "series": ["LS6", "LS9"],
    "hypothesis": "对标小鹏 GX/N70/N90/小米等，LS9 在 B 柱扶手、三排充电口、三排电动折叠、后排滑轨等便利配置上存在差距；用户同时偏好半隐藏式门把手等设计。",
    "issue_ids": ["ISS-0014", "ISS-0015", "ISS-0016", "ISS-0028", "ISS-0029", "ISS-0030"],
    "competitive_refs": ["小鹏GX", "N70", "N90", "小米"],
    "confidence": "medium",
    "status": "confirmed",
    "boundary": "多为单店或单条对标观察，反映差距方向而非量化程度。",
    "created_at": "2026-09-11"
  },
  {
    "pattern_id": "PAT-0012",
    "pattern_key": "driving_dynamics_steering_tech_demo",
    "title": "驾驶卖点传达受损（后轮转向/线控）",
    "category": "driving_dynamics",
    "series": ["L6", "LS6"],
    "hypothesis": "新款 L6 后轮转向被反馈不如老款，LS6 线控转向又缺乏试驾机会，削弱驾驶卖点的传达与体验。",
    "issue_ids": ["ISS-0020", "ISS-0021"],
    "competitive_refs": [],
    "confidence": "low",
    "status": "confirmed",
    "boundary": "店长主观反馈为主，缺少对比试驾的量化数据。",
    "created_at": "2026-09-11"
  },
  {
    "pattern_id": "PAT-0013",
    "pattern_key": "brand_channel_attraction_constraint",
    "title": "品牌认知与渠道吸引力约束销售",
    "category": "other",
    "series": ["LS6", "OTHER"],
    "hypothesis": "品牌认知度低、门店自然客流质量弱，叠加竞品分流，构成销售端的系统性约束。",
    "issue_ids": ["ISS-0022", "ISS-0023"],
    "competitive_refs": ["小米", "小鹏", "零跑C16", "阿维塔07"],
    "confidence": "medium",
    "status": "confirmed",
    "boundary": "运营层证据，受门店位置与区域市场影响，不可外推为全国判断。",
    "created_at": "2026-09-11"
  },
  {
    "pattern_id": "PAT-0014",
    "pattern_key": "demand_wait_for_new_model",
    "title": "用户持币观望、等待新款",
    "category": "other",
    "series": ["L6", "LS6"],
    "hypothesis": "老款吸引力不足叠加配额未抢到，用户转向等待新款，形成短期锁单抑制。",
    "issue_ids": ["ISS-0024"],
    "competitive_refs": [],
    "confidence": "low",
    "status": "confirmed",
    "boundary": "单店单时点，属时间性现象，可能随新款发布消退。",
    "created_at": "2026-09-11"
  },
  {
    "pattern_id": "PAT-0015",
    "pattern_key": "verified_product_service_strengths",
    "title": "已验证的产品与服务优势项",
    "category": "other",
    "series": ["LS6", "LS8", "OTHER"],
    "hypothesis": "雨天辅助驾驶、LS8 人群适配与门店接待服务是被正面验证的优势，应保留并在营销中放大。",
    "issue_ids": ["ISS-0025", "ISS-0026", "ISS-0027"],
    "competitive_refs": [],
    "confidence": "medium",
    "status": "confirmed",
    "boundary": "正面证据条数少且分散，作为定性优势信号，不代表满意度评分。",
    "created_at": "2026-09-11"
  }
]
