[
  {
    "pattern_id": "PAT-0001",
    "pattern_key": "model_positioning_audience_fit",
    "title": "车型定位与目标人群匹配问题",
    "category": "other",
    "series": ["L6"],
    "hypothesis": "当区域用户更倾向 SUV、而 L6 所在轿车细分目标群体偏小且到店占比偏低时，L6 的车型结构与区域人群之间存在落差，可能影响其客群获取与分流效率。",
    "issue_ids": ["ISS-0001"],
    "competitive_refs": [],
    "confidence": "low",
    "status": "confirmed",
    "boundary": "2 条证据跨 2 店（遵义播州、重庆礼嘉）、1 天；均为定性自报，不能外推为总体车型结构结论。",
    "created_at": "2026-09-27"
  },
  {
    "pattern_id": "PAT-0002",
    "pattern_key": "low_tier_demand_preference_shift",
    "title": "低线城市需求向智能化与显性配置倾斜",
    "category": "other",
    "series": ["L6", "LS6"],
    "hypothesis": "低线城市用户更关注「看得见」的功能配置，且油车转电车的置换用户更主动询问智驾配置，说明低线城市需求结构可能正向显性配置与智能化倾斜。",
    "issue_ids": ["ISS-0002"],
    "competitive_refs": [],
    "confidence": "low",
    "status": "confirmed",
    "boundary": "2 条证据跨 2 店（遵义黔北、遵义播州）、1 天；为专家观察汇总，未量化配置与智驾的偏好比例。",
    "created_at": "2026-09-27"
  },
  {
    "pattern_id": "PAT-0003",
    "pattern_key": "configuration_decontent_perception",
    "title": "配置认知与新老款差异影响价值判断",
    "category": "configuration",
    "series": ["L6", "LS6"],
    "hypothesis": "客户对新老款配置差异的关注（甚至感知不到明显差异），反映配置对比是价值判断的重要环节；差异沟通不清可能削弱用户对产品价值的感知。",
    "issue_ids": ["ISS-0003"],
    "competitive_refs": [],
    "confidence": "low",
    "status": "confirmed",
    "boundary": "2 条证据跨 2 店（重庆礼嘉、重庆新光里）、1 天；为关注与感知信号，未量化其对决策的影响。",
    "created_at": "2026-09-27"
  },
  {
    "pattern_id": "PAT-0004",
    "pattern_key": "demand_wait_for_new_model",
    "title": "用户持币观望、等待新款",
    "category": "other",
    "series": ["LS8"],
    "hypothesis": "客户明确等待 LS8 纯电版本上市，反映部分需求被新版本身份推迟释放。",
    "issue_ids": ["ISS-0004"],
    "competitive_refs": [],
    "confidence": "low",
    "status": "confirmed",
    "boundary": "单店单条专家观察；stated intent 不等同于实际锁单/退订行为。",
    "created_at": "2026-09-27"
  },
  {
    "pattern_id": "PAT-0005",
    "pattern_key": "price_equity_decision_barrier",
    "title": "价格与权益预期成为短期决策抑制",
    "category": "configuration",
    "series": ["L6", "LS6"],
    "hypothesis": "用户对价格高度敏感，并担心购车后降价或权益赠送，价格与权益预期的不确定性可能推迟短期购买决策。",
    "issue_ids": ["ISS-0005"],
    "competitive_refs": [],
    "confidence": "low",
    "status": "confirmed",
    "boundary": "2 条证据跨 2 店（重庆龙湖、重庆新光里）、1 天；为价格态度信号，未直接对应退单或流失行为。",
    "created_at": "2026-09-27"
  },
  {
    "pattern_id": "PAT-0006",
    "pattern_key": "brand_channel_attraction_constraint",
    "title": "品牌认知与渠道吸引力约束销售",
    "category": "other",
    "series": ["L6", "LS6"],
    "hypothesis": "智己品牌知名度虽在上升但仍需提高，品牌认知不足可能持续约束到店与决策。",
    "issue_ids": ["ISS-0006"],
    "competitive_refs": [],
    "confidence": "low",
    "status": "confirmed",
    "boundary": "单店单条专家观察；未量化品牌认知对到店客流或转化的影响。",
    "created_at": "2026-09-27"
  },
  {
    "pattern_id": "PAT-0007",
    "pattern_key": "steering_by_wire_reliability_trust",
    "title": "线控转向安全可靠性与信任顾虑",
    "category": "driving_dynamics",
    "series": ["LS6"],
    "hypothesis": "部分用户对线控转向的安全可靠性存在疑虑，若缺少质量与售后的信任支撑，可能削弱这一技术卖点的说服力。",
    "issue_ids": ["ISS-0007"],
    "competitive_refs": [],
    "confidence": "low",
    "status": "confirmed",
    "boundary": "单店单条专家观察；未记录用户对安全可靠性的具体顾虑来源。",
    "created_at": "2026-09-27"
  },
  {
    "pattern_id": "PAT-0008",
    "pattern_key": "verified_product_service_strengths",
    "title": "已验证的产品与服务优势项",
    "category": "sales_service",
    "series": ["L6", "LS6"],
    "hypothesis": "用户对配置与座舱静态体验评价高，产品专家以专业真诚的服务赢得信任，可作为一线可复用的优势叙事。",
    "issue_ids": ["ISS-0008"],
    "competitive_refs": [],
    "confidence": "low",
    "status": "confirmed",
    "boundary": "3 条证据跨 2 店、1 天；正向信号为各店自报，未与成交/锁单数据做归因。",
    "created_at": "2026-09-27"
  },
  {
    "pattern_id": "PAT-0009",
    "pattern_key": "store_operations_conversion_levers",
    "title": "门店运营与转化动作建议",
    "category": "sales_service",
    "series": ["L6", "LS6"],
    "hypothesis": "针对用户对显性配置的关注，强化后轮转向、智驾实际表现等卖点的营销传达，可能提升转化的有效性。",
    "issue_ids": ["ISS-0009"],
    "competitive_refs": [],
    "confidence": "low",
    "status": "confirmed",
    "boundary": "单店单条专家建议；未验证营销强化对转化的实际效果。",
    "created_at": "2026-09-27"
  },
  {
    "pattern_id": "PAT-0010",
    "pattern_key": "ls6_user_persona_segmentation",
    "title": "LS6 用户画像细分与置换结构",
    "category": "other",
    "series": ["LS6"],
    "hypothesis": "LS6 慢闪用户可细分为男性单身青年与朋友、年轻无孩夫妻、单孩中年夫妻等群体，油车升级置换占比高，女性用户更关注电池安全，说明客群结构与购车关注点存在群体差异。",
    "issue_ids": ["ISS-0010"],
    "competitive_refs": [],
    "confidence": "low",
    "status": "confirmed",
    "boundary": "单店两条专家观察（遵义吾悦慢闪）；为单店画像观察，不能外推为总体客群结构。",
    "created_at": "2026-09-27"
  }
]
