[
  {
    "pattern_id": "PAT-0001",
    "pattern_key": "model_positioning_audience_fit",
    "title": "车型定位与低线城市用户关注点错配",
    "category": "other",
    "series": ["L6", "LS6"],
    "hypothesis": "当 L6 与 LS6 价格区间重叠、且低线城市用户更关注显性功能配置时，L6 的差异化价值与低线市场的沟通重点可能不匹配，进而影响内部车型分流与转化效率。",
    "issue_ids": ["ISS-0001", "ISS-0002"],
    "competitive_refs": [],
    "confidence": "low",
    "status": "confirmed",
    "boundary": "2 条证据跨 2 店（重庆南岸、遵义黔北）、1 天；均为定性自报，不能外推为总体定位结论。",
    "created_at": "2026-09-26"
  },
  {
    "pattern_id": "PAT-0002",
    "pattern_key": "smart_cockpit_voice_assistant",
    "title": "智能座舱语音体验不稳定",
    "category": "smart_cockpit",
    "series": ["L6", "LS6"],
    "hypothesis": "客户对龙虾智能体（IM Claw）能做什么的期待有限，更关心语音控制的实际精准性与流畅性，说明座舱智能的卖点需要落到可感知的语音执行质量上。",
    "issue_ids": ["ISS-0003"],
    "competitive_refs": [],
    "confidence": "low",
    "status": "confirmed",
    "boundary": "单店单条专家观察；未量化客户对语音体验的满意度或流失影响。",
    "created_at": "2026-09-26"
  },
  {
    "pattern_id": "PAT-0003",
    "pattern_key": "smart_cockpit_screen_heat",
    "title": "座舱屏幕发热",
    "category": "smart_cockpit",
    "series": ["LS6"],
    "hypothesis": "LS6 中控屏在使用中出现明显发热，可能影响座舱交互体验与用户对品质的感知。",
    "issue_ids": ["ISS-0004"],
    "competitive_refs": [],
    "confidence": "low",
    "status": "confirmed",
    "boundary": "单店单条专家观察，未记录发热的场景、时长与频率。",
    "created_at": "2026-09-26"
  },
  {
    "pattern_id": "PAT-0004",
    "pattern_key": "seating_zero_gravity_lumbar_support",
    "title": "副驾零重力座椅腰部支撑不足",
    "category": "seating_space",
    "series": ["LS8"],
    "hypothesis": "LS8 副驾在零重力模式下腰部支撑不足，可能削弱零重力座椅这一舒适卖点的实际体验价值。",
    "issue_ids": ["ISS-0005"],
    "competitive_refs": [],
    "confidence": "low",
    "status": "confirmed",
    "boundary": "单店单条用户反馈，未量化乘坐时长或不同身材用户的差异。",
    "created_at": "2026-09-26"
  },
  {
    "pattern_id": "PAT-0005",
    "pattern_key": "configuration_steering_system_packaging",
    "title": "线控转向配置策略存在跨车型认知疑问",
    "category": "configuration",
    "series": ["LS6", "LS8"],
    "hypothesis": "LS6 标配线控转向而 LS8 需加钱选装，可能让用户对不同车型的配置逻辑产生疑问，增加一线解释成本并影响价值判断。",
    "issue_ids": ["ISS-0006"],
    "competitive_refs": [],
    "confidence": "low",
    "status": "confirmed",
    "boundary": "单店单条用户疑问；未获取用户对配置策略的完整理解或竞品对照。",
    "created_at": "2026-09-26"
  },
  {
    "pattern_id": "PAT-0006",
    "pattern_key": "driving_experience_value_demonstration",
    "title": "试驾与驾驶价值传达不足",
    "category": "driving_dynamics",
    "series": ["L6", "LS6"],
    "hypothesis": "在静态展示下用户感受不到与其它品牌的差距、试驾意愿不高时，底盘等驾驶优势难以被感知，驾驶卖点传达受损。",
    "issue_ids": ["ISS-0007"],
    "competitive_refs": [],
    "confidence": "low",
    "status": "confirmed",
    "boundary": "单店单条专家观察；未获取试驾转化率或底盘对比的量化数据。",
    "created_at": "2026-09-26"
  },
  {
    "pattern_id": "PAT-0007",
    "pattern_key": "demand_wait_for_new_model",
    "title": "用户持币观望、等待价格或新款",
    "category": "other",
    "series": ["L6", "LS6", "LS8"],
    "hypothesis": "用户对比竞品价格后观望、并关注 LS8 纯电上市时间，反映部分需求被价格预期与新版本身份推迟释放。",
    "issue_ids": ["ISS-0008", "ISS-0009"],
    "competitive_refs": [],
    "confidence": "low",
    "status": "confirmed",
    "boundary": "2 条证据跨 2 店、1 天；stated intent 不等同于实际锁单/退订行为。",
    "created_at": "2026-09-26"
  },
  {
    "pattern_id": "PAT-0008",
    "pattern_key": "low_tier_demand_preference_shift",
    "title": "低线城市需求向智能化与纯电倾斜",
    "category": "other",
    "series": ["LS6", "LS8"],
    "hypothesis": "即便在三线城市，用户对智驾要求较高、相比增程更偏好纯电（增程顾虑集中在保养成本），反映低线城市需求结构可能正向智能化与纯电倾斜。",
    "issue_ids": ["ISS-0010"],
    "competitive_refs": [],
    "confidence": "low",
    "status": "confirmed",
    "boundary": "单店两条专家观察，未量化智驾/动力的偏好比例，不能外推为总体结构。",
    "created_at": "2026-09-26"
  },
  {
    "pattern_id": "PAT-0009",
    "pattern_key": "configuration_decontent_perception",
    "title": "配置认知与减配感知影响价值判断",
    "category": "configuration",
    "series": ["L6", "LS6"],
    "hypothesis": "客户对新老款配置差异的关注，反映配置对比是价值判断的重要环节；配置沟通不清可能削弱用户对产品价值的感知。",
    "issue_ids": ["ISS-0011"],
    "competitive_refs": [],
    "confidence": "low",
    "status": "confirmed",
    "boundary": "单店单条专家观察；该条目为关注信号而非减配抱怨，语义仅部分重合于原 pattern。",
    "created_at": "2026-09-26"
  },
  {
    "pattern_id": "PAT-0010",
    "pattern_key": "verified_product_service_strengths",
    "title": "已验证的产品与服务优势项",
    "category": "other",
    "series": ["L6", "LS6", "LS8"],
    "hypothesis": "交付中心到店意愿、服务口碑、产品认可、家庭空间满意度、锁单表现、人群区隔与线控转向吸引力等正向信号在多店出现，可作为一线可复用的优势叙事。",
    "issue_ids": ["ISS-0012"],
    "competitive_refs": [],
    "confidence": "low",
    "status": "confirmed",
    "boundary": "正向信号为各店自报，未与成交/锁单数据做归因，不能量化贡献。",
    "created_at": "2026-09-26"
  }
]
