[
  {
    "pattern_id": "PAT-0001",
    "pattern_key": "model_positioning_audience_fit",
    "title": "车型定位与目标人群匹配问题",
    "category": "other",
    "series": ["LS6", "L6"],
    "hypothesis": "品牌对一二线城市用户的定位与三四线城市用户更看重油电转换能力的心智存在错位，可能导致低线城市的产品叙事与用户关注点不匹配。",
    "issue_ids": ["ISS-0001"],
    "competitive_refs": [],
    "confidence": "low",
    "status": "confirmed",
    "boundary": "单店单条自报观察；「油电转换能力」为一线的定性表述，不能外推为总体人群偏好。",
    "created_at": "2026-09-19"
  },
  {
    "pattern_id": "PAT-0002",
    "pattern_key": "interior_detail_usability_perception",
    "title": "内饰细节设计与操作感知",
    "category": "interior",
    "series": ["LS6", "L6"],
    "hypothesis": "内饰中副驾屏、化妆镜等细节的设计与操作方式若不符合用户直觉，会影响使用体验与进店第一印象。",
    "issue_ids": ["ISS-0002"],
    "competitive_refs": ["小米", "问界"],
    "confidence": "low",
    "status": "confirmed",
    "boundary": "2 条证据跨 2 店、1 天；均为定性个别反馈，不能量化影响面。",
    "created_at": "2026-09-19"
  },
  {
    "pattern_id": "PAT-0003",
    "pattern_key": "storage_front_trunk_capacity",
    "title": "前部与车内储物空间不足",
    "category": "storage",
    "series": ["LS6"],
    "hypothesis": "前备箱等前部储物的开启与容量体验若不顺畅，会削弱储物实用性感知。",
    "issue_ids": ["ISS-0003"],
    "competitive_refs": [],
    "confidence": "low",
    "status": "confirmed",
    "boundary": "单店单条证据；仅说明现象存在，不能量化发生率。",
    "created_at": "2026-09-19"
  },
  {
    "pattern_id": "PAT-0004",
    "pattern_key": "smart_cockpit_voice_assistant",
    "title": "智能座舱语音体验不稳定",
    "category": "smart_cockpit",
    "series": ["LS6"],
    "hypothesis": "语音识别准确率不稳定会影响智能座舱的基础体验感知。",
    "issue_ids": ["ISS-0004"],
    "competitive_refs": [],
    "confidence": "low",
    "status": "confirmed",
    "boundary": "单店单条专家观察；未记录具体触发场景。",
    "created_at": "2026-09-19"
  },
  {
    "pattern_id": "PAT-0005",
    "pattern_key": "demand_wait_for_new_model",
    "title": "用户持币观望、等待新款",
    "category": "other",
    "series": ["LS6"],
    "hypothesis": "用户对增程版本焕新节奏的询问，反映部分需求在等待版本更新后再决策，转化可能被推迟。",
    "issue_ids": ["ISS-0005"],
    "competitive_refs": [],
    "confidence": "low",
    "status": "confirmed",
    "boundary": "单店单条用户询问；stated intent 不等同于实际锁单/退订行为。",
    "created_at": "2026-09-19"
  },
  {
    "pattern_id": "PAT-0006",
    "pattern_key": "configuration_decontent_perception",
    "title": "配置减配感知削弱价值感",
    "category": "configuration",
    "series": ["L6"],
    "hypothesis": "高定版相对基础版的溢价若缺少可感知价值支撑，会削弱用户对高定配置的价值认可。",
    "issue_ids": ["ISS-0006"],
    "competitive_refs": [],
    "confidence": "low",
    "status": "confirmed",
    "boundary": "单店单条用户质疑；高定版具体配置未在反馈中展开。",
    "created_at": "2026-09-19"
  },
  {
    "pattern_id": "PAT-0007",
    "pattern_key": "interior_sharp_edge_injury_risk",
    "title": "内饰锐角造成磕碰与划伤风险",
    "category": "quality_reliability",
    "series": ["L6"],
    "hypothesis": "高定版内饰元素若存在粗糙棱角，可能带来刮手感与磕碰风险，影响做工质感评价。",
    "issue_ids": ["ISS-0007"],
    "competitive_refs": [],
    "confidence": "low",
    "status": "confirmed",
    "boundary": "单店单条专家观察，未收集实际受伤实例。",
    "created_at": "2026-09-19"
  },
  {
    "pattern_id": "PAT-0008",
    "pattern_key": "competitor_emotional_value_differentiation",
    "title": "竞品情绪价值与个性化差距",
    "category": "other",
    "series": ["L6"],
    "hypothesis": "用户将竞品的情绪价值、个性化与差异化作为比较维度，可能影响 L6 的价值感知与偏好。",
    "issue_ids": ["ISS-0008"],
    "competitive_refs": ["竞品"],
    "confidence": "low",
    "status": "confirmed",
    "boundary": "单店单条用户表述，未指明具体竞品与对比车型。",
    "created_at": "2026-09-19"
  }
]
