[
  {
    "pattern_id": "PAT-0001",
    "pattern_key": "competitor_smart_space_benchmark",
    "title": "竞品智能可感知对标差距",
    "category": "smart_cockpit",
    "series": ["LS6"],
    "hypothesis": "车机对话等智能座舱交互若低于竞品可感知水平，会成为用户横向对比时的负面锚点。",
    "issue_ids": ["ISS-0001"],
    "competitive_refs": ["小米", "理想"],
    "confidence": "low",
    "status": "confirmed",
    "boundary": "单店单条用户对比表述，未指明具体竞品车型，不能量化差距。",
    "created_at": "2026-09-20"
  },
  {
    "pattern_id": "PAT-0002",
    "pattern_key": "interior_detail_usability_perception",
    "title": "内饰细节设计与操作感知",
    "category": "interior",
    "series": ["LS6"],
    "hypothesis": "主副驾屏等内饰细节的视觉设计若不被用户直觉接受，会拉低内饰第一印象与价值感知。",
    "issue_ids": ["ISS-0002"],
    "competitive_refs": [],
    "confidence": "low",
    "status": "confirmed",
    "boundary": "单店单条用户观感表述；「怪」为主观感受，未展开具体设计问题。",
    "created_at": "2026-09-20"
  },
  {
    "pattern_id": "PAT-0003",
    "pattern_key": "interior_luxury_material_perception",
    "title": "内饰豪华感与质感不足（跨车型）",
    "category": "interior",
    "series": ["LS6"],
    "hypothesis": "内饰材质与豪华感表达若弱于同级竞品（如阿维塔），即便已减少塑料感，仍会削弱用户对内饰价值的认可。",
    "issue_ids": ["ISS-0003"],
    "competitive_refs": ["阿维塔"],
    "confidence": "low",
    "status": "confirmed",
    "boundary": "证据集中在单店单日；「像 2001 年」为个别用户吐槽，不能外推为普遍评价。",
    "created_at": "2026-09-20"
  },
  {
    "pattern_id": "PAT-0004",
    "pattern_key": "design_narrative_competitor_led",
    "title": "配置与设计叙事受竞品带动、解释成本高",
    "category": "other",
    "series": ["LS6"],
    "hypothesis": "当座舱配置与外观设计（头等舱式座舱、门把手）的叙事被竞品主导时，一线需承担更高的解释成本，且用户接受度存在不确定性。",
    "issue_ids": ["ISS-0004"],
    "competitive_refs": ["理想"],
    "confidence": "low",
    "status": "confirmed",
    "boundary": "单店单条专家观察；「阿联酋头等舱」为原文表述，语义待一线澄清后再验证。",
    "created_at": "2026-09-20"
  },
  {
    "pattern_id": "PAT-0005",
    "pattern_key": "brand_channel_attraction_constraint",
    "title": "品牌认知与渠道吸引力约束销售",
    "category": "other",
    "series": ["L6", "LS6"],
    "hypothesis": "品牌小众认知与工作日自然客流不足相互叠加，门店展台更多承担广告曝光职能而非直接转化。",
    "issue_ids": ["ISS-0005"],
    "competitive_refs": [],
    "confidence": "low",
    "status": "confirmed",
    "boundary": "2 条证据跨 2 店、1 天；工作日客流受时点影响，不能外推为常态比例。",
    "created_at": "2026-09-20"
  },
  {
    "pattern_id": "PAT-0006",
    "pattern_key": "store_operations_conversion_levers",
    "title": "门店运营与转化动作建议",
    "category": "sales_service",
    "series": ["L6", "LS6"],
    "hypothesis": "在自然客流受限时，有效的线索下发是门店形成订单的关键运营抓手。",
    "issue_ids": ["ISS-0006"],
    "competitive_refs": [],
    "confidence": "low",
    "status": "confirmed",
    "boundary": "单店单条一线建议，未提供线索下发效率数据，需更多门店验证。",
    "created_at": "2026-09-20"
  }
]
