[
  {
    "pattern_id": "PAT-0001",
    "pattern_key": "store_footfall_context_quality",
    "title": "门店客流情境与到店质量分化",
    "category": "sales_service",
    "series": ["L6", "LS6", "LS8"],
    "hypothesis": "国庆次日到店量与进店质量受外部情境（天气、商场活动、假期客流结构）与门店形态主导而分化：交付中心与核心门店客流放大且高意向，快闪/商超型门店以走马观花为主，展点被外部活动遮挡时获客骤降，节假日外地探亲客流则难以在本地转化。",
    "issue_ids": ["ISS-0001"],
    "competitive_refs": [],
    "confidence": "low",
    "status": "confirmed",
    "boundary": "7 条证据跨 6 店、1 天；为各店自报观察，未与客流计数或转化数据做归因。",
    "created_at": "2026-10-02"
  },
  {
    "pattern_id": "PAT-0002",
    "pattern_key": "verified_product_service_strengths",
    "title": "已验证的产品与服务优势项",
    "category": "other",
    "series": ["L6", "LS6", "LS8", "LS9"],
    "hypothesis": "底盘与空间体验、LS6 家庭用户适配与性价比、相同配置下的价格优势、L6 外观设计、宁德时代电池背书、展示色与试驾体验，构成本期可复用的产品优势叙事。",
    "issue_ids": ["ISS-0002"],
    "competitive_refs": [],
    "confidence": "low",
    "status": "confirmed",
    "boundary": "13 条证据跨 6 店、跨多车型、1 天；正向信号为各店自报，未与成交/锁单数据做归因。",
    "created_at": "2026-10-02"
  },
  {
    "pattern_id": "PAT-0003",
    "pattern_key": "store_operations_conversion_levers",
    "title": "门店运营与转化动作建议",
    "category": "sales_service",
    "series": ["L6", "LS6"],
    "hypothesis": "多店在版本配置对比物料、线上传播引流、核心竞品对标公示上给出较一致建议，并出现直播建议落地反馈，说明一线认为可视化物料与线上动作是当前提升进店与转化的关键抓手。",
    "issue_ids": ["ISS-0003"],
    "competitive_refs": [],
    "confidence": "low",
    "status": "confirmed",
    "boundary": "4 条证据跨 4 店、1 天；为一线建议与落地反馈，未验证各动作对进店/转化的实际效果。",
    "created_at": "2026-10-02"
  },
  {
    "pattern_id": "PAT-0004",
    "pattern_key": "brand_channel_attraction_constraint",
    "title": "品牌认知与渠道吸引力约束销售",
    "category": "other",
    "series": ["L6", "LS6"],
    "hypothesis": "智己品牌知名度较过往支持时已大幅提升，但一线仍将品牌曝光视为吸引主动到店的关键抓手，说明品牌认知在改善但仍是到店约束。",
    "issue_ids": ["ISS-0004"],
    "competitive_refs": [],
    "confidence": "low",
    "status": "confirmed",
    "boundary": "2 条证据跨 2 店、1 天；一为认知改善观察、一为曝光建议，未量化品牌认知对到店或转化的影响。",
    "created_at": "2026-10-02"
  },
  {
    "pattern_id": "PAT-0005",
    "pattern_key": "demand_wait_for_new_model",
    "title": "用户持币观望、等待新款",
    "category": "other",
    "series": ["LS6"],
    "hypothesis": "已出新款后老款虽有价格优惠，用户仍在新老款之间纠结，说明新老款并存与价格差可能拉长决策周期。",
    "issue_ids": ["ISS-0005"],
    "competitive_refs": [],
    "confidence": "low",
    "status": "confirmed",
    "boundary": "单店单条专家观察、1 天；为选择纠结信号，不等同于实际退单或流失。",
    "created_at": "2026-10-02"
  },
  {
    "pattern_id": "PAT-0006",
    "pattern_key": "launch_rhythm_derivative_sync",
    "title": "上市节奏与版本排期建议",
    "category": "other",
    "series": ["L6", "LS6", "LS8"],
    "hypothesis": "用户希望新车覆盖双动力形式，并认为 LS8 纯电更早上市可能提升赢率，说明动力形式覆盖与纯电上市节奏是影响等待与选择的因素。",
    "issue_ids": ["ISS-0006"],
    "competitive_refs": [],
    "confidence": "low",
    "status": "confirmed",
    "boundary": "2 条证据跨 2 店、1 天；为产品诉求与用户判断，非可验证的销量结论。",
    "created_at": "2026-10-02"
  },
  {
    "pattern_id": "PAT-0007",
    "pattern_key": "model_positioning_audience_fit",
    "title": "车型定位与目标人群匹配问题",
    "category": "other",
    "series": ["L6", "LS6"],
    "hypothesis": "L6 与 LS6 在部分价格带存在定位重叠，用户对比后认为 L6 性价比不高、在两车间纠结，说明内部车型存在相互分流与定位落差。",
    "issue_ids": ["ISS-0007"],
    "competitive_refs": [],
    "confidence": "low",
    "status": "confirmed",
    "boundary": "单店单条专家观察、1 天；为个案观察与销售转述，不能外推为总体车型结构结论。",
    "created_at": "2026-10-02"
  },
  {
    "pattern_id": "PAT-0008",
    "pattern_key": "purchase_consideration_non_urgent",
    "title": "非刚需与选择过载拉长决策周期",
    "category": "sales_service",
    "series": ["L6", "LS6"],
    "hypothesis": "到店用户普遍对多产品充分对比，且即便明确权益、完成试驾后仍难当场下单，说明选择过载与决策审慎拉长了转化周期。",
    "issue_ids": ["ISS-0008"],
    "competitive_refs": [],
    "confidence": "low",
    "status": "confirmed",
    "boundary": "单店单条专家观察、1 天；为转化态度信号，未量化对锁单率的影响。",
    "created_at": "2026-10-02"
  },
  {
    "pattern_id": "PAT-0009",
    "pattern_key": "existing_owner_loyalty_benefit",
    "title": "老用户权益与品牌忠诚度维护",
    "category": "sales_service",
    "series": ["L6", "LS6", "LS9"],
    "hypothesis": "一线建议发动老带新、维护老客户口碑，且出现 LS9 Hyper 车主主动带朋友到店看车，说明老用户口碑与转介绍是尚未充分运营的忠诚度资源。",
    "issue_ids": ["ISS-0009"],
    "competitive_refs": [],
    "confidence": "low",
    "status": "confirmed",
    "boundary": "3 条证据跨 3 店、1 天；为建议与个案转介绍，未量化为实际转介绍或复购贡献。",
    "created_at": "2026-10-02"
  },
  {
    "pattern_id": "PAT-0010",
    "pattern_key": "competitor_smart_space_benchmark",
    "title": "竞品智能与空间可感知对标差距",
    "category": "smart_cockpit",
    "series": ["LS6"],
    "hypothesis": "用户直接对比后认为竞品智舱语音（华为系、理想）优势明显，并视其为下单卡点，说明智舱语音体验存在可被感知且影响决策的竞品差距。",
    "issue_ids": ["ISS-0010"],
    "competitive_refs": ["华为系", "理想"],
    "confidence": "low",
    "status": "confirmed",
    "boundary": "单店单条用户对标原话、1 天；未记录对比的具体车型与语音细分差异点。",
    "created_at": "2026-10-02"
  },
  {
    "pattern_id": "PAT-0011",
    "pattern_key": "price_equity_decision_barrier",
    "title": "价格与权益预期成为短期决策抑制",
    "category": "configuration",
    "series": ["L6", "LS6"],
    "hypothesis": "进店客户询问价格且总想要赠品，说明价格与赠品权益预期仍可能抑制短期购买决策。",
    "issue_ids": ["ISS-0011"],
    "competitive_refs": [],
    "confidence": "low",
    "status": "confirmed",
    "boundary": "单店单条专家观察、1 天；为价格与权益态度信号，未直接对应退单或流失行为。",
    "created_at": "2026-10-02"
  },
  {
    "pattern_id": "PAT-0012",
    "pattern_key": "store_display_vehicle_staleness",
    "title": "门店展车为旧款、物料未更新影响看车留客",
    "category": "sales_service",
    "series": ["LS6"],
    "hypothesis": "门店 LS6 展车售出后陈列旧款且物料未更新，客户上手敲前备箱、试电吸门后因是老款而错失惊艳留客，部分客户不上车体验，说明展车新旧与物料状态直接影响看车体验与留客。",
    "issue_ids": ["ISS-0012"],
    "competitive_refs": [],
    "confidence": "medium",
    "status": "confirmed",
    "boundary": "4 条证据集中在同一门店（贵阳悦然时光）、1 天；为单店观察，不能外推为全网门店状态。",
    "created_at": "2026-10-02"
  },
  {
    "pattern_id": "PAT-0013",
    "pattern_key": "sales_service_consultation_quality",
    "title": "门店销售服务与讲解水平存在店间差异",
    "category": "sales_service",
    "series": ["L6", "LS6"],
    "hypothesis": "一线反馈中既有主理热情专业、销售队伍成熟高效的正面评价，也有建议提高销售介绍积极性的意见，说明门店销售服务与讲解水平存在店间差异。",
    "issue_ids": ["ISS-0013"],
    "competitive_refs": [],
    "confidence": "low",
    "status": "confirmed",
    "boundary": "3 条证据跨 3 店、1 天；为服务层面主观观察，未建立与转化的量化关系。",
    "created_at": "2026-10-02"
  },
  {
    "pattern_id": "PAT-0014",
    "pattern_key": "in_car_audio_playback_glitch",
    "title": "车载音响播放偶发异常（天空扬声器无声）",
    "category": "quality_reliability",
    "series": ["L6"],
    "hypothesis": "用户在静态体验 L6 时出现天空扬声器疑似无声，更换音源后恢复，说明存在偶发的车载音响播放异常，可能与音源或软件状态相关。",
    "issue_ids": ["ISS-0014"],
    "competitive_refs": [],
    "confidence": "low",
    "status": "confirmed",
    "boundary": "单店单条观察且问题已自行恢复、1 天；无法判断根因，不能作为质量缺陷结论。",
    "created_at": "2026-10-02"
  }
]
