[
  {
    "pattern_id": "PAT-0001",
    "pattern_key": "brand_channel_attraction_constraint",
    "title": "品牌认知与渠道吸引力约束销售",
    "category": "other",
    "series": ["L6", "LS6"],
    "hypothesis": "用户对品牌不够熟悉、品牌知名度尚需提高，且小城市客户更看重品牌力并倾向以性价比购买“名牌”；品牌认知不足可能持续约束到店与决策。",
    "issue_ids": ["ISS-0001"],
    "competitive_refs": [],
    "confidence": "low",
    "status": "confirmed",
    "boundary": "2 条证据跨 2 店、1 天；均为定性自报，未量化品牌认知对到店客流或转化的影响。",
    "created_at": "2026-10-01"
  },
  {
    "pattern_id": "PAT-0002",
    "pattern_key": "store_footfall_context_quality",
    "title": "门店客流情境与到店质量分化",
    "category": "sales_service",
    "series": ["L6", "LS6"],
    "hypothesis": "节日首日到店总量受天气（降雨/降温）主导，且附近友商普遍偏低；快闪、商超与地下商场型门店以路过/散步型客流为主、深度体验较少，而雨天到店客源质量反而较高，说明到店量与进店质量受外部情境与门店形态影响而分化。",
    "issue_ids": ["ISS-0002"],
    "competitive_refs": [],
    "confidence": "low",
    "status": "confirmed",
    "boundary": "6 条证据跨 5 店、1 天；为各店自报观察，未与客流计数或转化数据做归因。",
    "created_at": "2026-10-01"
  },
  {
    "pattern_id": "PAT-0003",
    "pattern_key": "adas_capability_brand_trust",
    "title": "智驾能力与技术品牌认知担忧",
    "category": "adas",
    "series": ["LS6", "LS9"],
    "hypothesis": "用户对智驾供应商认知度不高，且 LS9 潜客更慎重考量技术品牌含金量（上汽归属、Momenta 背景），技术品牌信任的缺位可能削弱智驾卖点的说服力。",
    "issue_ids": ["ISS-0003"],
    "competitive_refs": [],
    "confidence": "low",
    "status": "confirmed",
    "boundary": "2 条证据跨 2 店、跨 LS6/LS9、1 天；未记录用户对技术品牌的具体顾虑来源与决策权重。",
    "created_at": "2026-10-01"
  },
  {
    "pattern_id": "PAT-0004",
    "pattern_key": "price_equity_decision_barrier",
    "title": "价格与权益预期成为短期决策抑制",
    "category": "configuration",
    "series": ["L6", "LS6"],
    "hypothesis": "用户即便愿意坐下来深谈，仍在价格与权益上存在拉扯并选择考虑后再联系，价格与权益预期的不确定可能推迟短期购买决策。",
    "issue_ids": ["ISS-0004"],
    "competitive_refs": [],
    "confidence": "low",
    "status": "confirmed",
    "boundary": "单店单条专家观察、1 天；为价格态度信号，未直接对应退单或流失行为。",
    "created_at": "2026-10-01"
  },
  {
    "pattern_id": "PAT-0005",
    "pattern_key": "verified_product_service_strengths",
    "title": "已验证的产品与服务优势项",
    "category": "sales_service",
    "series": ["L6", "LS6", "LS8"],
    "hypothesis": "交付中心高意向客流与锁单、用户对底盘与空间的好评、LS6 带来的潜客关注与座舱体验、LS8 预算导向潜客、LS6 高性价比与底盘认可、以及训练有素的门店团队，构成本期可复用的产品与服务优势叙事。",
    "issue_ids": ["ISS-0005"],
    "competitive_refs": [],
    "confidence": "low",
    "status": "confirmed",
    "boundary": "11 条证据跨 7 店、跨 LS6/LS8、1 天；正向信号为各店自报，未与成交/锁单数据做归因。",
    "created_at": "2026-10-01"
  },
  {
    "pattern_id": "PAT-0006",
    "pattern_key": "existing_owner_loyalty_benefit",
    "title": "老用户权益与口碑转介绍",
    "category": "sales_service",
    "series": ["LS9", "L6", "LS6"],
    "hypothesis": "老车主复购并愿为产品宣传、门店建议发动老客户带人进店，说明老用户口碑与转介绍是尚未充分运营的忠诚度资源。",
    "issue_ids": ["ISS-0006"],
    "competitive_refs": [],
    "confidence": "low",
    "status": "confirmed",
    "boundary": "2 条证据跨 2 店、1 天；为一线观察与建议，未量化为实际转介绍或复购贡献。",
    "created_at": "2026-10-01"
  },
  {
    "pattern_id": "PAT-0007",
    "pattern_key": "competitor_smart_space_benchmark",
    "title": "竞品智能与空间可感知对标差距",
    "category": "smart_cockpit",
    "series": ["LS6"],
    "hypothesis": "用户直接对比后认为竞品车机更好用，说明车机体验存在可被感知的竞品对标差距。",
    "issue_ids": ["ISS-0007"],
    "competitive_refs": [],
    "confidence": "low",
    "status": "confirmed",
    "boundary": "单店单条用户对标反馈、1 天；未记录对比的具体竞品与差异点。",
    "created_at": "2026-10-01"
  },
  {
    "pattern_id": "PAT-0008",
    "pattern_key": "interior_luxury_material_perception",
    "title": "内饰豪华感与质感不足",
    "category": "interior",
    "series": ["L6"],
    "hypothesis": "用户对 L6 内饰质感的评价一般，说明内饰质感可能成为对标中的短板，削弱价值感。",
    "issue_ids": ["ISS-0008"],
    "competitive_refs": [],
    "confidence": "low",
    "status": "confirmed",
    "boundary": "单店单条用户对标反馈、1 天；为整体感知评价，未定位到具体部件或材质。",
    "created_at": "2026-10-01"
  },
  {
    "pattern_id": "PAT-0009",
    "pattern_key": "competitor_promotion_perk_gap",
    "title": "竞品促销赠品与异业引流差距",
    "category": "sales_service",
    "series": ["L6", "LS6"],
    "hypothesis": "竞品在赠品（脚垫、头枕）和异业引流（极氪×奶茶店「试驾送奶茶」）上形成可感知动作，可能在与智己的对比中影响短期转化。",
    "issue_ids": ["ISS-0009"],
    "competitive_refs": ["极氪"],
    "confidence": "low",
    "status": "confirmed",
    "boundary": "2 条证据跨 2 店、1 天；为竞品动作观察与用户反馈，未验证其实际转化效果。",
    "created_at": "2026-10-01"
  },
  {
    "pattern_id": "PAT-0010",
    "pattern_key": "model_positioning_audience_fit",
    "title": "车型定位与区域市场适配问题",
    "category": "other",
    "series": ["L6"],
    "hypothesis": "L6 在部分门店到店关注度低、无 L6 意向客户，且贵州地势促使当地客户对低底盘车辆拒购明显，说明 L6 的车型定位与区域市场需求存在适配落差。",
    "issue_ids": ["ISS-0010"],
    "competitive_refs": [],
    "confidence": "low",
    "status": "confirmed",
    "boundary": "3 条证据跨 2 店（均在贵阳）、1 天；为门店观察与区域特性，不能外推为总体车型结构结论。",
    "created_at": "2026-10-01"
  },
  {
    "pattern_id": "PAT-0011",
    "pattern_key": "store_operations_conversion_levers",
    "title": "门店运营与转化动作建议",
    "category": "sales_service",
    "series": ["L6", "LS6"],
    "hypothesis": "多店在直播、引流活动、试驾赠饮、进店打卡与选址协同上给出较一致的运营建议，说明一线认为可感知的引流与体验动作是当前提升进店与转化的关键抓手。",
    "issue_ids": ["ISS-0011"],
    "competitive_refs": [],
    "confidence": "low",
    "status": "confirmed",
    "boundary": "8 条证据跨 8 店、1 天；为一线建议，未验证各动作对进店/转化的实际效果。",
    "created_at": "2026-10-01"
  },
  {
    "pattern_id": "PAT-0012",
    "pattern_key": "local_market_communication_barrier",
    "title": "本地化沟通适配不足影响留资",
    "category": "sales_service",
    "series": ["L6", "LS6"],
    "hypothesis": "非本地口音沟通让本地客户产生距离感、拒留资较多，说明在方言/口音明显的下沉市场，本地化沟通能力可能直接影响留资意愿。",
    "issue_ids": ["ISS-0012"],
    "competitive_refs": [],
    "confidence": "low",
    "status": "confirmed",
    "boundary": "单店单条专家观察（遵义）、1 天；未量化口音对留资率的影响，也未排除其他留资障碍。",
    "created_at": "2026-10-01"
  }
]
