[
  {
    "pattern_id": "PAT-0001",
    "pattern_key": "brand_channel_attraction_constraint",
    "title": "品牌认知与渠道吸引力约束销售",
    "category": "other",
    "series": ["LS6", "L6"],
    "hypothesis": "品牌认知不足与店端自然客流/线索约束相互强化：认知低降低主动到店，客流不足又减少认知触达，共同构成转化前置约束。",
    "issue_ids": ["ISS-0001", "ISS-0007"],
    "competitive_refs": ["知名度更高的竞品"],
    "confidence": "medium",
    "status": "confirmed",
    "boundary": "来自 4 家门店、2 天自报样本；不能据此估计总体品牌认知比例。",
    "created_at": "2026-09-12"
  },
  {
    "pattern_id": "PAT-0002",
    "pattern_key": "adas_capability_brand_trust",
    "title": "智驾能力与品牌认知担忧",
    "category": "adas",
    "series": ["LS6"],
    "hypothesis": "momenta 智驾的供应商认知与信任不足，在华为等强认知竞品对照下削弱智驾价值感知，可能影响智驾相关决策。",
    "issue_ids": ["ISS-0002"],
    "competitive_refs": ["华为", "momenta"],
    "confidence": "medium",
    "status": "confirmed",
    "boundary": "3 条证据跨 3 店 2 天；认知度无法量化，仅能说明落差方向。",
    "created_at": "2026-09-12"
  },
  {
    "pattern_id": "PAT-0003",
    "pattern_key": "configuration_decontent_perception",
    "title": "配置减配感知削弱价值感",
    "category": "configuration",
    "series": ["LS6", "L6"],
    "hypothesis": "显性配置（外门把手电容感应）仅前排具备，销售为回避暴露缺失而不主动讲解，反而削弱卖点价值。",
    "issue_ids": ["ISS-0003"],
    "confidence": "medium",
    "status": "confirmed",
    "boundary": "单店单条证据，指向具体部件与销售行为；待更多门店验证普遍性。",
    "created_at": "2026-09-12"
  },
  {
    "pattern_id": "PAT-0004",
    "pattern_key": "interior_luxury_material_perception",
    "title": "内饰豪华感与质感不足（跨车型）",
    "category": "interior",
    "series": ["LS6", "L6", "LS8", "LS9"],
    "hypothesis": "内外饰与车漆质感决定用户第一印象；质感不足或偏好分化会削弱进店后的好感与偏好形成。",
    "issue_ids": ["ISS-0004"],
    "confidence": "medium",
    "status": "confirmed",
    "boundary": "3 条证据跨 3 店 2 天；样本为自报第一印象，非盲测。",
    "created_at": "2026-09-12"
  },
  {
    "pattern_id": "PAT-0005",
    "pattern_key": "demand_wait_for_new_model",
    "title": "用户持币观望、等待新款",
    "category": "other",
    "series": ["LS6", "L6"],
    "hypothesis": "价格与权益政策预期不稳放大用户持币观望：老客觉得盲订不实惠、新客受网络口碑影响，转化被推迟。",
    "issue_ids": ["ISS-0005"],
    "confidence": "medium",
    "status": "confirmed",
    "boundary": "3 条证据集中在重庆 3 店 1 天；观望原因可能与上市临近相关，需结合节奏解读。",
    "created_at": "2026-09-12"
  },
  {
    "pattern_id": "PAT-0006",
    "pattern_key": "model_positioning_audience_fit",
    "title": "车型定位与目标人群匹配问题",
    "category": "other",
    "series": ["LS6", "L6", "LS8", "LS9"],
    "hypothesis": "车型定位与目标人群区隔不够清晰，导致部分车型在特定城市/人群匹配度低，并出现跨车型客流溢出。",
    "issue_ids": ["ISS-0006"],
    "confidence": "low",
    "status": "confirmed",
    "boundary": "4 条证据跨 3 店；人群判断来自专家观察，非结构化画像数据。",
    "created_at": "2026-09-12"
  },
  {
    "pattern_id": "PAT-0007",
    "pattern_key": "verified_product_service_strengths",
    "title": "已验证的产品与服务优势项",
    "category": "other",
    "series": ["LS6", "L6"],
    "hypothesis": "后轮转向、大满配定价、试驾转化与门店人气是当前已验证的正向动因，可作为卖点与打法复用。",
    "issue_ids": ["ISS-0008", "ISS-0009", "ISS-0010", "ISS-0013"],
    "competitive_refs": [],
    "confidence": "medium",
    "status": "confirmed",
    "boundary": "正向证据来自少数门店的短期观察，适合作为打法假设而非成熟结论。",
    "created_at": "2026-09-12"
  },
  {
    "pattern_id": "PAT-0008",
    "pattern_key": "competitor_smart_space_benchmark",
    "title": "竞品智能与空间可感知对标差距",
    "category": "smart_cockpit",
    "series": ["LS6"],
    "hypothesis": "竞品在智能交互与空间等可感知维度形成参照，可能分流对智能/空间敏感的用户。",
    "issue_ids": ["ISS-0012"],
    "competitive_refs": ["理想", "小米 N70"],
    "confidence": "low",
    "status": "confirmed",
    "boundary": "单条转述对标，仅作为待验证的竞争假设。",
    "created_at": "2026-09-12"
  }
]
