[
  {"pattern_id":"PAT-0001","pattern_key":"demand_wait_for_new_model","title":"等待新款、降价与权益变化抑制短期决策","category":"configuration","series":["LS6","LS8","LS9","L6"],"hypothesis":"当用户担忧新车上市后降价或增加赠配，或期待老款降价时，购车决策可能延后；明确价格保护和权益边界或能缓解观望。","issue_ids":["ISS-0001"],"confidence":"medium","status":"confirmed","boundary":"10/06 多店定性自报；没有匹配的成交、订单或价格变动数据，不能量化对转化的影响。","created_at":"2026-10-06"},
  {"pattern_id":"PAT-0002","pattern_key":"launch_rhythm_derivative_sync","title":"用户提出 LS6 增程版本需求","category":"configuration","series":["LS6"],"hypothesis":"部分用户对 LS6 的配置与价格评价积极，但动力形式偏好可能影响其车型选择。","issue_ids":["ISS-0002"],"confidence":"low","status":"confirmed","boundary":"单店单条反馈，仅代表需求线索，不代表需求规模或上市节奏建议。","created_at":"2026-10-06"},
  {"pattern_id":"PAT-0003","pattern_key":"brand_channel_attraction_constraint","title":"品牌识别与可信叙事影响门店获客沟通","category":"sales_service","series":["OTHER"],"hypothesis":"品牌混淆或持续经营疑虑可能增加到店沟通成本；清晰、可验证的品牌与服务信息或有助于建立认知。","issue_ids":["ISS-0003"],"confidence":"medium","status":"confirmed","boundary":"来自 4 家门店的单日定性观察；存在个别客户离店描述，但不能据此判定品牌认知是离店的唯一原因。","created_at":"2026-10-06"},
  {"pattern_id":"PAT-0004","pattern_key":"store_footfall_context_quality","title":"客流量与到店意向质量在门店间分化","category":"sales_service","series":["OTHER"],"hypothesis":"商圈、假期节奏及到店目的可能共同影响门店客流与留资质量，需要把流量和意向分别观察。","issue_ids":["ISS-0004"],"confidence":"medium","status":"confirmed","boundary":"两家门店的单日定性反馈，门店口径和客流量未统一；不作城市或假期因果推断。","created_at":"2026-10-06"},
  {"pattern_id":"PAT-0005","pattern_key":"driving_dynamics_steering_tech_demo","title":"线控转向卖点需依靠试驾呈现","category":"driving_dynamics","series":["LS6"],"hypothesis":"线控转向的差异感知可能不易通过静态讲解形成，实际驾驶体验或更能呈现其特点。","issue_ids":["ISS-0005"],"confidence":"medium","status":"confirmed","boundary":"两家门店当日观察；未记录试驾前后用户评价的系统比较，不能推断转化提升。","created_at":"2026-10-06"},
  {"pattern_id":"PAT-0006","pattern_key":"store_operations_conversion_levers","title":"门店尝试通过传播、活动与空间运营引流","category":"sales_service","series":["OTHER"],"hypothesis":"直播、地方车展、老客转介绍和开放展厅等动作可能增加触达与到店机会，效果需要小范围跟踪验证。","issue_ids":["ISS-0006"],"confidence":"medium","status":"confirmed","boundary":"多店一线建议，不是已实施动作或效果评估；不能据此判断不同动作的投入产出。","created_at":"2026-10-06"},
  {"pattern_id":"PAT-0007","pattern_key":"verified_product_service_strengths","title":"LS6 配置价值与外观色彩获得正向反馈","category":"configuration","series":["LS6"],"hypothesis":"配置完整度和部分车色接受度可作为沟通与陈列线索，但需结合更广泛用户反馈验证。","issue_ids":["ISS-0007"],"confidence":"low","status":"confirmed","boundary":"两家门店专家观察；没有配置选择或颜色偏好的结构化统计，不代表整体市场偏好。","created_at":"2026-10-06"},
  {"pattern_id":"PAT-0008","pattern_key":"model_positioning_audience_fit","title":"竞品与车型偏好需按具体维度呈现","category":"other","series":["LS6","LS8","L6","OTHER"],"hypothesis":"用户可能分别在驾驶感受、座舱智能、内饰质感和外观风格上比较不同车型，按维度呈现证据比笼统的车型优劣更有解释力。","issue_ids":["ISS-0008"],"competitive_refs":["特斯拉 Model Y","特斯拉 Model 3","极氪 7X"],"confidence":"low","status":"confirmed","boundary":"两家门店的少量定性记录，涉及不同车型与用户个案，不可外推为竞品总体评价或人群画像。","created_at":"2026-10-06"}
]
